{
  "nodes": [
    {
      "id": "PLA-CMD-001",
      "name": "CMC Joint Operations Command Center Beijing",
      "team": "red",
      "subsystem": "Firepower Strike",
      "domain": [
        "Land"
      ],
      "type": "Command",
      "health": 100,
      "healthMax": 100,
      "status": "Active",
      "difficulty": "Buried",
      "vulnerabilities": [
        "Cyber",
        "SOF"
      ],
      "importance": 10,
      "cascScore": 5,
      "resourceGenByType": {
        "kinetic": 0,
        "cyber": 0,
        "ew": 0,
        "sof": 0
      },
      "x": 0,
      "y": 300,
      "z": 0,
      "lat": 39.9042,
      "lon": 116.4074,
      "resourceGen": 0
    },
    {
      "id": "PLA-CMD-002",
      "name": "Eastern Theater Command JOC Fuzhou",
      "team": "red",
      "subsystem": "Firepower Strike",
      "domain": [
        "Land"
      ],
      "type": "Command",
      "health": 100,
      "healthMax": 100,
      "status": "Active",
      "difficulty": "Fortified",
      "vulnerabilities": [
        "Cyber",
        "Precision Strike"
      ],
      "importance": 10,
      "cascScore": 5,
      "resourceGenByType": {
        "kinetic": 0,
        "cyber": 0,
        "ew": 0,
        "sof": 0
      },
      "x": 100,
      "y": 100,
      "z": 0,
      "lat": 26.08,
      "lon": 119.3,
      "resourceGen": 0
    },
    {
      "id": "PLA-CMD-003",
      "name": "Southern Theater Command JOC Guangzhou",
      "team": "red",
      "subsystem": "Blockade",
      "domain": [
        "Land"
      ],
      "type": "Command",
      "health": 100,
      "healthMax": 100,
      "status": "Active",
      "difficulty": "Fortified",
      "vulnerabilities": [
        "Cyber",
        "Precision Strike"
      ],
      "importance": 9,
      "cascScore": 5,
      "resourceGenByType": {
        "kinetic": 0,
        "cyber": 0,
        "ew": 0,
        "sof": 0
      },
      "x": 50,
      "y": -100,
      "z": 0,
      "lat": 23.1291,
      "lon": 113.2644,
      "resourceGen": 0
    },
    {
      "id": "PLA-CMD-004",
      "name": "Eastern TC Army HQ Nanjing",
      "team": "red",
      "subsystem": "Assault",
      "domain": [
        "Land"
      ],
      "type": "Command",
      "health": 100,
      "healthMax": 100,
      "status": "Active",
      "difficulty": "Fortified",
      "vulnerabilities": [
        "Cyber",
        "Missile"
      ],
      "importance": 8,
      "cascScore": 5,
      "resourceGenByType": {
        "kinetic": 0,
        "cyber": 0,
        "ew": 0,
        "sof": 0
      },
      "x": 120,
      "y": 150,
      "z": 0,
      "lat": 32.0603,
      "lon": 118.7969,
      "resourceGen": 0
    },
    {
      "id": "PLA-CMD-005",
      "name": "Eastern TC Navy HQ Ningbo",
      "team": "red",
      "subsystem": "Blockade",
      "domain": [
        "Sea"
      ],
      "type": "Command",
      "health": 100,
      "healthMax": 100,
      "status": "Active",
      "difficulty": "Fortified",
      "vulnerabilities": [
        "Cyber",
        "Missile"
      ],
      "importance": 8,
      "cascScore": 5,
      "resourceGenByType": {
        "kinetic": 0,
        "cyber": 0,
        "ew": 0,
        "sof": 0
      },
      "x": 150,
      "y": 200,
      "z": 0,
      "lat": 29.8683,
      "lon": 121.5495,
      "resourceGen": 0
    },
    {
      "id": "PLA-CMD-006",
      "name": "Eastern TC Air Force HQ Nanjing",
      "team": "red",
      "subsystem": "Firepower Strike",
      "domain": [
        "Air"
      ],
      "type": "Command",
      "health": 100,
      "healthMax": 100,
      "status": "Active",
      "difficulty": "Fortified",
      "vulnerabilities": [
        "Cyber",
        "Missile"
      ],
      "importance": 8,
      "cascScore": 5,
      "resourceGenByType": {
        "kinetic": 0,
        "cyber": 0,
        "ew": 0,
        "sof": 0
      },
      "x": 130,
      "y": 160,
      "z": 0,
      "lat": 32.0603,
      "lon": 118.7969,
      "resourceGen": 0
    },
    {
      "id": "PLA-CMD-007",
      "name": "73rd Group Army HQ Xiamen",
      "team": "red",
      "subsystem": "Assault",
      "domain": [
        "Land"
      ],
      "type": "Command",
      "health": 100,
      "healthMax": 100,
      "status": "Active",
      "difficulty": "Fortified",
      "vulnerabilities": [
        "Missile",
        "Air"
      ],
      "importance": 8,
      "cascScore": 5,
      "resourceGenByType": {
        "kinetic": 0,
        "cyber": 0,
        "ew": 0,
        "sof": 0
      },
      "x": 80,
      "y": 50,
      "z": 0,
      "lat": 24.4798,
      "lon": 118.0894,
      "resourceGen": 0
    },
    {
      "id": "PLA-CMD-008",
      "name": "72nd Group Army HQ Huzhou",
      "team": "red",
      "subsystem": "Assault",
      "domain": [
        "Land"
      ],
      "type": "Command",
      "health": 100,
      "healthMax": 100,
      "status": "Active",
      "difficulty": "Fortified",
      "vulnerabilities": [
        "Missile",
        "Air"
      ],
      "importance": 7,
      "cascScore": 4,
      "resourceGenByType": {
        "kinetic": 0,
        "cyber": 0,
        "ew": 0,
        "sof": 0
      },
      "x": 140,
      "y": 180,
      "z": 0,
      "lat": 30.867,
      "lon": 120.1025,
      "resourceGen": 0
    },
    {
      "id": "PLA-CMD-009",
      "name": "71st Group Army HQ Huainan",
      "team": "red",
      "subsystem": "Assault",
      "domain": [
        "Land"
      ],
      "type": "Command",
      "health": 100,
      "healthMax": 100,
      "status": "Active",
      "difficulty": "Fortified",
      "vulnerabilities": [
        "Missile",
        "Air"
      ],
      "importance": 7,
      "cascScore": 4,
      "resourceGenByType": {
        "kinetic": 0,
        "cyber": 0,
        "ew": 0,
        "sof": 0
      },
      "x": 110,
      "y": 170,
      "z": 0,
      "lat": 32.6264,
      "lon": 116.9989,
      "resourceGen": 0
    },
    {
      "id": "PLA-CMD-010",
      "name": "PLARF Eastern Operations Base",
      "team": "red",
      "subsystem": "Firepower Strike",
      "domain": [
        "Land"
      ],
      "type": "Command",
      "health": 100,
      "healthMax": 100,
      "status": "Active",
      "difficulty": "Buried",
      "vulnerabilities": [
        "Deep Strike",
        "SOF"
      ],
      "importance": 9,
      "cascScore": 5,
      "resourceGenByType": {
        "kinetic": 0,
        "cyber": 0,
        "ew": 0,
        "sof": 0
      },
      "x": 50,
      "y": 250,
      "z": 0,
      "lat": 26.5,
      "lon": 118.5,
      "resourceGen": 0
    },
    {
      "id": "PLA-CMD-011",
      "name": "CMC Information Support Force Network Operations Center",
      "team": "red",
      "subsystem": "Information Attack",
      "domain": [
        "Cyber",
        "Land"
      ],
      "type": "Command",
      "health": 100,
      "healthMax": 100,
      "status": "Active",
      "difficulty": "Fortified",
      "vulnerabilities": [
        "Cyber",
        "EMP"
      ],
      "importance": 8,
      "cascScore": 5,
      "resourceGenByType": {
        "kinetic": 0,
        "cyber": 0,
        "ew": 0,
        "sof": 0
      },
      "x": 130,
      "y": 140,
      "z": 0,
      "lat": 31.5689,
      "lon": 120.303,
      "resourceGen": 0,
      "locationPrecision": "theater-aggregate",
      "capabilityProfile": {
        "category": "network-information-support",
        "functions": [
          "network-operations",
          "joint-information-support"
        ],
        "evidenceClass": "observed",
        "confidence": "high",
        "availability": "scenario-active",
        "sourceRefs": [
          "DOD-CMPR-2024",
          "DOD-CMPR-2025"
        ],
        "assumption": "Observed organization and mission class; the modeled operations center, marker, and theater relationship are analytical aggregates."
      }
    },
    {
      "id": "PLA-CMD-012",
      "name": "CMC Aerospace Force Space Operations Center",
      "team": "red",
      "subsystem": "Information Attack",
      "domain": [
        "Space"
      ],
      "type": "Command",
      "health": 100,
      "healthMax": 100,
      "status": "Active",
      "difficulty": "Buried",
      "vulnerabilities": [
        "ASAT",
        "Cyber"
      ],
      "importance": 9,
      "cascScore": 5,
      "resourceGenByType": {
        "kinetic": 0,
        "cyber": 0,
        "ew": 0,
        "sof": 0
      },
      "x": 0,
      "y": 280,
      "z": 0,
      "lat": 39.9,
      "lon": 116.4,
      "resourceGen": 0,
      "locationPrecision": "theater-aggregate",
      "capabilityProfile": {
        "category": "space-command",
        "functions": [
          "space-command-and-control",
          "mission-integration"
        ],
        "evidenceClass": "observed",
        "confidence": "high",
        "availability": "scenario-active",
        "sourceRefs": [
          "DOD-CMPR-2024",
          "DOD-CMPR-2025"
        ],
        "assumption": "Observed force role represented as a single service node; location and capacity are illustrative."
      }
    },
    {
      "id": "PLA-CMD-013",
      "name": "PLAN South Sea Fleet HQ Zhanjiang",
      "team": "red",
      "subsystem": "Blockade",
      "domain": [
        "Sea"
      ],
      "type": "Command",
      "health": 100,
      "healthMax": 100,
      "status": "Active",
      "difficulty": "Fortified",
      "vulnerabilities": [
        "Missile",
        "Air"
      ],
      "importance": 8,
      "cascScore": 5,
      "resourceGenByType": {
        "kinetic": 0,
        "cyber": 0,
        "ew": 0,
        "sof": 0
      },
      "x": 0,
      "y": -150,
      "z": 0,
      "lat": 21.2749,
      "lon": 110.3594,
      "resourceGen": 0
    },
    {
      "id": "PLA-CMD-014",
      "name": "Southern TC Navy Marine Corps HQ Chaozhou",
      "team": "red",
      "subsystem": "Assault",
      "domain": [
        "Sea",
        "Land"
      ],
      "type": "Command",
      "health": 100,